{
  "$schema": "../../schemas/option-collection.schema.json",
  "tool": "ship-generator",
  "collection": "bites",
  "title": "Ship Bites",
  "description": "Required design choice. The mechanism that lets a ship cut through or traverse the tangled waves. Multiple bites may be taken.",
  "selection": { "min": 1, "max": 2, "allowMultiple": true },
  "ratingKeys": ["armour", "seals", "speed", "saws", "stealth", "tilt"],
  "order": 4,
  "options": [
    {
      "id": "sawprow",
      "name": "Sawprow",
      "category": "common",
      "stakes": 1,
      "description": "A chainsaw edge running down the curve of the prow, capable of cutting through most obstructions.",
      "ratings": { "saws": 1 },
      "tags": ["chainsaw"],
      "source": "Core Rules p.170",
      "special": "Deals massive CQ Serrated damage when ramming."
    },
    {
      "id": "impellers",
      "name": "Impellers",
      "category": "common",
      "stakes": 1,
      "description": "Large jet-like outboard engines that push the ship through the waves with brute force.",
      "ratings": { "speed": 1 },
      "tags": ["engine"],
      "source": "Core Rules p.170",
      "special": "Deals massive CQ Blast damage when ramming."
    },
    {
      "id": "crawler",
      "name": "Crawler",
      "category": "common",
      "stakes": 1,
      "description": "Large finger-like mechanisms that spread around the front of the ship, letting it move with a crawling motion.",
      "ratings": { "tilt": 1 },
      "tags": ["walking"],
      "source": "Core Rules p.170",
      "special": "Deals massive CQ Blunt damage when ramming."
    },
    {
      "id": "underscales",
      "name": "Underscales",
      "category": "common",
      "stakes": 1,
      "description": "Thousands of flexing scales that worm the ship forward with a sly, sinuous motion.",
      "ratings": { "stealth": 1 },
      "tags": ["scale"],
      "source": "Core Rules p.170",
      "special": "Deals massive CQ Keen damage when ramming."
    },
    {
      "id": "jag-tracks",
      "name": "Jag-Tracks",
      "category": "common",
      "stakes": 1,
      "description": "Motorised grapple tracks along the keel and hull-sides; a slow, solid, and reliable choice.",
      "ratings": { "armour": 1 },
      "tags": ["tracked"],
      "source": "Core Rules p.170",
      "special": "Deals massive CQ Hewing damage when ramming."
    },
    {
      "id": "sluicejets",
      "name": "Sluicejets",
      "category": "common",
      "stakes": 1,
      "description": "Pressurised sluice systems filled with phytophobic chemicals, for coating the hull and pushing the ship.",
      "ratings": { "seals": 1 },
      "tags": ["chemical"],
      "source": "Core Rules p.170",
      "special": "Deals massive CQ Acid damage when ramming."
    },
    {
      "id": "longjaw",
      "name": "Longjaw",
      "category": "advanced",
      "stakes": 2,
      "description": "An underslung chainsaw arrangement that extends from the front of the ship, chewing and pulling forward.",
      "ratings": { "saws": 1, "speed": 1 },
      "tags": ["chainsaw"],
      "source": "Core Rules p.171",
      "special": "Deals massive CQ Serrated damage when ramming."
    },
    {
      "id": "propeller-cage",
      "name": "Propeller-Cage",
      "category": "advanced",
      "stakes": 2,
      "description": "A cage housing that holds large airboat-style propellers used to push the ship forward.",
      "ratings": { "speed": 1, "armour": 1 },
      "tags": ["propeller"],
      "source": "Core Rules p.171",
      "special": "Deals massive CQ Blunt damage when ramming."
    },
    {
      "id": "navapede-limbs",
      "name": "Navapede Limbs",
      "category": "advanced",
      "stakes": 2,
      "description": "Centipedal limbs lining the hull, letting a ship scuttle through the thrash.",
      "ratings": { "tilt": 1, "stealth": 1 },
      "tags": ["insect"],
      "source": "Core Rules p.171",
      "special": "Deals massive CQ Spike damage when ramming."
    },
    {
      "id": "voltaic-runners",
      "name": "Voltaic Runners",
      "category": "advanced",
      "stakes": 2,
      "description": "Crackling with barely contained lightning, these outboard contraptions let a ship float just above the churning branches.",
      "ratings": { "seals": 2 },
      "tags": ["electric"],
      "source": "Core Rules p.171",
      "special": "Deals massive CQ Volt damage when ramming."
    },
    {
      "id": "mulcher",
      "name": "Mulcher",
      "category": "advanced",
      "stakes": 2,
      "description": "Grinding teeth in a lamprey-style mouth. Terribly noisy but dreadfully effective.",
      "ratings": { "saws": 2, "armour": 1, "stealth": -1 },
      "tags": ["grinding", "loud"],
      "source": "Core Rules p.171",
      "special": "Deals massive CQ Serrated damage when ramming."
    },
    {
      "id": "tentaculari",
      "name": "Tentaculari",
      "category": "advanced",
      "stakes": 2,
      "description": "A living cluster of tendrils or tentacles attached to the hull, carrying the ship in an unsettlingly alien motion.",
      "ratings": { "tilt": 2 },
      "tags": ["living"],
      "source": "Core Rules p.171",
      "special": "Deals massive CQ Salt damage when ramming."
    },
    {
      "id": "square-sail",
      "name": "Square Sail",
      "category": "sails",
      "stakes": 1,
      "description": "Taut canvas that relies on a strong breeze, harking back to an age of calm, clear waters.",
      "ratings": { "speed": 1 },
      "tags": ["sail", "wind"],
      "source": "Core Rules p.171",
      "special": "Only effective in favourable winds.",
      "meta": { "requiresEngine": false }
    },
    {
      "id": "sleek-sail",
      "name": "Sleek Sail",
      "category": "sails",
      "stakes": 1,
      "description": "Triangular and manually angled, relying on an attentive crew to catch the right breezes.",
      "ratings": { "stealth": 1 },
      "tags": ["sail", "wind"],
      "source": "Core Rules p.171",
      "special": "Only effective in favourable winds.",
      "meta": { "requiresEngine": false }
    },
    {
      "id": "sweat-sails",
      "name": "Sweat-Sails",
      "category": "sails",
      "stakes": 1,
      "description": "Held low to the waves, unfurled canvases shaped to catch the rising under-canopy heat.",
      "ratings": { "speed": 1 },
      "tags": ["sail", "heat"],
      "source": "Core Rules p.171",
      "special": "Only effective in warm weather.",
      "meta": { "requiresEngine": false }
    },
    {
      "id": "tethered-kites",
      "name": "Tethered Kites",
      "category": "sails",
      "stakes": 2,
      "description": "An array of kites that catch the stronger winds of the lower air.",
      "ratings": { "speed": 2 },
      "tags": ["sail", "wind"],
      "source": "Core Rules p.171",
      "special": "Only effective in favourable winds.",
      "meta": { "requiresEngine": false }
    },
    {
      "id": "gecko-sails",
      "name": "Gecko Sails",
      "category": "sails",
      "stakes": 2,
      "description": "A reinforced multi-sail arrangement designed to tame even the wildest gusts.",
      "ratings": { "speed": 1, "armour": 1 },
      "tags": ["sail", "wind"],
      "source": "Core Rules p.171",
      "special": "Only effective in favourable winds.",
      "meta": { "requiresEngine": false }
    },
    {
      "id": "sharpened-prow",
      "name": "Sharpened Prow",
      "category": "unique",
      "stakes": 0,
      "description": "A honed blade running the length of the ship's prow to cut through vegetation. Provides a cutting edge but no motive force.",
      "ratings": {},
      "tags": ["blade"],
      "source": "Core Rules p.171",
      "special": "Deals massive CQ Keen damage... or it would, if you could get up enough speed. Works best paired with oars."
    },
    {
      "id": "beast-reins",
      "name": "Beast-Reins",
      "category": "unique",
      "stakes": 1,
      "description": "A leash or yoke arrangement allowing well-trained beasts to pull the ship like a chariot.",
      "ratings": { "tilt": 1 },
      "tags": ["beast", "living"],
      "source": "Core Rules p.171",
      "special": "Decide what kind of beasts they hold. The beasts require care, feeding, and sleep.",
      "meta": { "requiresEngine": false }
    },
    {
      "id": "grappling-array",
      "name": "Grappling Array",
      "category": "unique",
      "stakes": 1,
      "description": "Prow-mounted grappling hooks fired out to catch branches, then laboriously wound back in for slow, inexorable progress.",
      "ratings": { "tilt": 2, "speed": -1 },
      "tags": ["grapple"],
      "source": "Core Rules p.171",
      "special": "A ship running solely on a grappling array cannot Forge Ahead during a journey. Deals massive LR Spike damage."
    }
  ]
}
